id,reviewId,creationDate,criticName,isTopCritic,originalScore,reviewState,publicatioName,reviewText,scoreSentiment,reviewUrl
censored_voices,2295624,2015-11-20,Glenn Kenny,True,3/4,fresh,RogerEbert.com,"""A society that won't tell itself the truth [...] is in big trouble,"" says one of the interviewees. The words have perhaps never been more true. And not just for Israel, as the movie implies.",POSITIVE,http://www.rogerebert.com/reviews/censored-voices-2015
censored_voices,2295391,2015-11-19,Daniel M. Gold,True,,fresh,New York Times,"An essential amendment to the historical record, ""Censored Voices"" reminds us that no war is entirely virtuous and makes clear that, even at the time, the dangers of becoming an occupying force were evident.",POSITIVE,http://www.nytimes.com/2015/11/20/movies/review-in-censored-voices-soldiers-reflect-on-the-six-day-war.html?partner=rss&emc=rss
censored_voices,2295211,2015-11-19,Alan Zilberman,True,4/4,fresh,Washington Post,"""Censored Voices"" is an essential documentary. Its subject is nothing less than loss of innocence, the seeds of hatred and the illusory nature of victory.",POSITIVE,http://www.washingtonpost.com/goingoutguide/movies/movie-review-censored-voices-unearths-old-memories-of-war/2015/11/19/41d35424-8a3d-11e5-be39-0034bb576eee_story.html
censored_voices,2295013,2015-11-18,Diana Clarke,True,,fresh,Village Voice,"Oz is the best-known novelist in Israel, notorious for supporting a two-state solution. If you don't yet understand why he does, watch this film. If you're already on Oz's side, keeping the wound open might be worth it.",POSITIVE,http://www.villagevoice.com/film/israeli-doc-censored-voices-finds-old-soldiers-speaking-pained-truths-7931214
censored_voices,2294635,2015-11-16,Clayton Dillard,True,2.5/4,rotten,Slant Magazine,"By negating more conventional, facts-first priorities, Mor Loushy creates an alternative historiography that's more meant to be felt than learned.",NEGATIVE,http://www.slantmagazine.com/film/review/censored-voices
censored_voices,2293886,2015-11-12,Stuart Klawans,False,,fresh,The Nation,"In its raw detail, though, the material in Censored Voices is new and indispensable.",POSITIVE,http://www.thenation.com/article/shes-leaving-home/
censored_voices,2289701,2015-10-18,Mark Kermode,True,3/5,fresh,Observer (UK),"Cutting between archive footage and new film of the interviewees listening silently to their testimony, Loushy reveals a soul-searching history of disillusionment, self-doubt and raw regret.",POSITIVE,http://www.theguardian.com/film/2015/oct/18/censored-voices-review-israel-six-day-war-documentary-mark-kermode
censored_voices,2289224,2015-10-15,Kevin Maher,True,3/5,fresh,Times (UK),"Censored Voices is a competent, satisfying, if not exactly revelatory, Israeli documentary about the Six-Day War.",POSITIVE,http://www.thetimes.co.uk/tto/arts/film/reviews/article4586866.ece
censored_voices,2289149,2015-10-15,David Jenkins,True,3/5,fresh,Little White Lies,Incendiary material treated in a (thankfully) non-incendiary manner.,POSITIVE,http://www.littlewhitelies.co.uk/theatrical-reviews/censored-voices-32082
censored_voices,2289074,2015-10-15,Peter Bradshaw,True,4/5,fresh,Guardian,It's a very sombre work.,POSITIVE,http://www.theguardian.com/film/2015/oct/15/censored-voices-review-amos-oz-six-day-war
censored_voices,2288536,2015-10-13,Dave Calhoun,True,3/5,fresh,Time Out,"A distinctly human, ground-level view of conflict.",POSITIVE,http://www.timeout.com/london/film/censored-voices
censored_voices,2265377,2015-06-03,David D'Arcy,False,,fresh,Screen International,"Censored Voices is a reminder that glorious myths of wars and the men who fight them wither under scrutiny, in Israel and everywhere else.",POSITIVE,http://www.screendaily.com/reviews/the-latest/censored-voices/5082910.article
censored_voices,2265376,2015-06-03,Boyd van Hoeij,True,,fresh,Hollywood Reporter,"Expertly assembled across the board, Censored Voices tries and largely succeeds in providing a corrective to the idea that Israel's 1967 victory was a quick and clean operation.",POSITIVE,http://www.hollywoodreporter.com/review/censored-voices-sundance-review-768290
censored_voices,2244707,2015-01-29,Ben Kenigsberg,True,,fresh,Variety,"Politically charged and intermittently cutting, if slightly dry and repetitive ...",POSITIVE,http://variety.com/2015/film/reviews/sundance-film-review-censored-voices-1201417616/
la_soga_salvation,2855927,2022-01-28,Rene Rodriguez,True,,rotten,Variety,"Despite the mayhem, the film remains curiously inert, unable to generate even the B-grade buzz of a lower-tier Liam Neeson paycheck picture.",NEGATIVE,https://variety.com/2022/film/reviews/la-soga-salvation-review-1235166223/
la_soga_salvation,2855728,2022-01-28,Julian Roman,False,3/5,fresh,MovieWeb,"La Soga Salvation is a worthy entry in the sicario genre. It's chock full of bloody violence, betrayals, and vengeance; but actually has a decent plot with emotional weight.",POSITIVE,https://movieweb.com/la-soga-salvation-review/
la_soga_salvation,2855713,2022-01-28,Beatrice Loayza,True,,rotten,New York Times,"""La Soga Salvation"" is the quintessential sequel-nobody-asked-for.",NEGATIVE,https://www.nytimes.com/2022/01/27/movies/la-soga-salvation-review.html
more_than_honey,2739457,2020-11-03,Liam Lacey,True,3/4,fresh,Globe and Mail,"For patient science-minded kids and adults, it should find the sweet spot between environmental advocacy and visual pleasure.",POSITIVE,https://www.theglobeandmail.com/arts/film/film-reviews/more-than-honey-the-buzz-over-bees/article16168713/
more_than_honey,2739456,2020-11-03,Eric Kohn,True,B,fresh,indieWire,The movie compensates for its murkier sections with a poignant outlook.,POSITIVE,https://www.indiewire.com/2012/08/locarno-review-markus-imhoofs-insightful-more-than-honey-concerns-a-lot-more-than-bees-in-crisis-45634/
more_than_honey,2627445,2019-09-18,Noah Berlatsky,False,,fresh,Splice Today,"More Than Honey is a reminder of how thoroughly humans have intertwined themselves with the other life on this planet, and vice versa.",POSITIVE,https://www.splicetoday.com/moving-pictures/we-and-the-bees
more_than_honey,2563241,2019-03-02,Daniel Green,False,3/5,fresh,CineVue,There's more than enough here to entertain bee enthusiasts and the environmentally-conscious curious alike.,POSITIVE,https://cine-vue.com/2013/09/film-review-more-than-honey.html
more_than_honey,2416100,2017-09-05,Larushka Ivan-Zadeh,True,3/5,fresh,metro.co.uk,"It's pretty clear that Imhoof is not a fan of US industrial-scale farming but rather than shove angry stats such as '80 per cent of plants rely on bee pollination' in your face, he prefers to fascinate viewers.",POSITIVE,http://metro.co.uk/2013/09/06/also-out-in-cinemas-the-great-beauty-more-than-honey-and-any-day-now-3951722/
more_than_honey,2184657,2014-01-23,Christopher Long,False,7/10,fresh,Movie Metropolis,Imhoof's globetrotting odyssey is more concerned with contemplation than investigation.,POSITIVE,http://moviemet.com/review/more-honey-blu-ray-review#.UuIDqrROnIU
more_than_honey,2181552,2014-01-01,Charlotte O'Sullivan,True,4/5,fresh,London Evening Standard,Markus Imhoof's bee documentary is so stuffed with surreal tableaux it makes your head spin.,POSITIVE,http://www.standard.co.uk/goingout/film/more-than-honey--film-review-8802244.html
more_than_honey,2181551,2014-01-01,Donald Clarke,True,3/5,fresh,Irish Times,It is the elegance of its images that sets it apart from previous doomed bee documentaries. The footage of individual animals going about their business is a sight to behold.,POSITIVE,http://www.irishtimes.com/culture/film/more-than-honey-1.1517466
more_than_honey,2181549,2014-01-01,Jennifer Merin,False,5/5,fresh,About.com,"More Than Honey is a phenomenally well-researched and thorough study of bees and their complex influence on human civilization, and an in depth investigation of the honeybee colony collapse disorder.",POSITIVE,http://documentaries.about.com/od/revie2/fr/More-Than-Honey-Movie-Review-2013.htm
more_than_honey,2181548,2014-01-01,John DeFore,True,,fresh,Hollywood Reporter,"Eye-popping photography should draw viewers to this thoughtful, revealing doc.",POSITIVE,http://www.hollywoodreporter.com/review/more-honey-film-review-567509
more_than_honey,2177224,2013-11-29,Dennis Schwartz,False,B+,fresh,Dennis Schwartz Movie Reviews,Stinging but positive film about bees.,POSITIVE,https://dennisschwartzreviews.com/morethanhoney/
more_than_honey,2162592,2013-09-06,Allan Hunter,False,4/5,fresh,Daily Express (UK),There is a lot to be learned from this thoughtful film as you marvel at the amazingly intimate images of colony life.,POSITIVE,http://www.express.co.uk/entertainment/films/427225/More-Than-Honey-review-and-trailer
more_than_honey,2162391,2013-09-05,Peter Bradshaw,True,3/5,fresh,Guardian,"An interesting, and interestingly laidback film, an almost restful look at honeybees and the way they are kept and cultivated across the world.",POSITIVE,http://www.theguardian.com/film/2013/sep/05/more-than-honey-review
more_than_honey,2162323,2013-09-05,Katherine McLaughlin,False,4/5,fresh,ViewLondon,"A fascinating, informative and startling documentary that explores the disappearance of the honeybee.",POSITIVE,http://www.viewlondon.co.uk/films/more-than-honey-film-review-52791.html
more_than_honey,2162322,2013-09-05,Mahir Miah,True,3/5,fresh,Little White Lies,You come out of the film none the wiser as to where the bees have all gone. But you still learn a hell of a lot about them.,POSITIVE,http://www.littlewhitelies.co.uk/theatrical-reviews/more-than-honey-24727
more_than_honey,2162184,2013-09-05,David Gritten,True,3/5,fresh,Daily Telegraph (UK),"Elegant, handsomely shot and often instructive, and its remarkable extended close-up sequences of bees' social structure are fascinating.",POSITIVE,http://telegraph.feedsportal.com/c/32726/f/568601/s/30d6a561/sc/38/l/0L0Stelegraph0O0Cculture0Cfilm0Cfilmreviews0C10A2845870CMore0EThan0EHoney0Ereview0Bhtml/story01.htm
more_than_honey,2161999,2013-09-04,Cath Clarke,True,3/5,fresh,Time Out,Summer's blitz of apocalypse movies has nothing on this bee doc.,POSITIVE,http://www.timeout.com/london/film/more-than-honey-2012
more_than_honey,2161845,2013-09-03,Tom Dawson,False,3/5,fresh,The List,Feels slightly diffuse in its analysis.,POSITIVE,http://film.list.co.uk/article/54514-more-than-honey/
more_than_honey,2161810,2013-09-02,David Parkinson,True,3/5,fresh,Empire Magazine,Informative and occasionally scary.,POSITIVE,http://www.empireonline.com/reviews/reviewcomplete.asp?FID=138273
more_than_honey,2158362,2013-08-12,Simon Kinnear,False,4/5,fresh,Total Film,"Astonishing macro-photography captures the bees in all their surreal beauty, presenting a tribute to nature's ""messenger of love"" and a warning of what might be lost.",POSITIVE,http://www.totalfilm.com/reviews/cinema/more-than-honey
more_than_honey,2157462,2013-08-07,Gary Goldstein,True,3/5,fresh,Los Angeles Times,"Oblique narrative aside, you can't beat the film's eye-popping visuals.",POSITIVE,"http://www.latimes.com/entertainment/movies/moviesnow/la-et-mn-more-than-honey-review-20130807,0,1229955.story"
more_than_honey,2154250,2013-07-19,Michael O'Sullivan,True,3/4,fresh,Washington Post,"What's really frightening about Honey isn't what a hive of angry bees might do to us, but what we've done to them.",POSITIVE,http://www.washingtonpost.com/goingoutguide/movies/more-than-honey-movie-review/2013/07/17/8663781a-ea64-11e2-8f22-de4bd2a2bd39_story.html
more_than_honey,2153079,2013-07-12,Stanley Kauffmann,True,,fresh,The New Republic,[Markus] Imhoof makes bees more important than they have previously seemed.,POSITIVE,http://www.newrepublic.com/article/113800/you-aint-seen-nothin-yet-magic-flute-more-honey-kauffmann#
more_than_honey,2152877,2013-07-11,Moira MacDonald,True,3/4,fresh,Seattle Times,"Imhoof's film is remarkable in its close-up photography. The bees loom large, like creatures from some mutant planet; dangle together in a delicate chain; and fill the air, floating like unusually vivid dust specks.",POSITIVE,
more_than_honey,2152722,2013-07-11,Marc Mohan,False,B,fresh,Oregonian,"A little more attention to fact checking would have given the other scientific assertions in ""More Than Honey"" added weight, but even so this remains a fascinating, sometimes visually stunning, call to action.",POSITIVE,http://www.oregonlive.com/movies/index.ssf/2013/07/more_than_honey_review_a_visua.html
more_than_honey,2152576,2013-07-11,Chris Hewitt,False,3/4,fresh,St. Paul Pioneer Press,"It's a lovely, idiosyncratic film.",POSITIVE,
more_than_honey,2152502,2013-07-11,Brian Orndorf,False,B+,fresh,Blu-ray.com,"There's plenty of information spread around the movie to consider and inspire, but at the very core of More Than Honey is an appreciation for the bee itself, valuing its mystery as it near the precipice of extermination.",POSITIVE,http://www.blu-ray.com/More-Than-Honey/212461/?show=preview
more_than_honey,2151925,2013-07-05,Robin Clifford,False,A-,fresh,Reeling Reviews,"""More than Honey"" has a majesty of its own.",POSITIVE,http://www.reelingreviews.com/morethanhoney.htm
more_than_honey,2151783,2013-07-04,Peter Keough,True,3/4,fresh,Boston Globe,Markus Imhoof's inventive and powerful documentary ...,POSITIVE,
more_than_honey,2148390,2013-06-18,Jay Weissberg,True,,fresh,Variety,"Most striking in ""Honey"" are closeups of the bees in their hives, symbiotically working together in creating their new queen: Imhoof rightfully spends time detailing the extraordinary nature of bee social structure.",POSITIVE,http://variety.com/2012/film/reviews/more-than-honey-1117948063/
more_than_honey,2148011,2013-06-15,Avi Offer,False,8.01/10,fresh,NYC Movie Guru,Concurrently frightening and breathtaking.,POSITIVE,http://nycmovieguru.com/june14th13.html#morethanhoney
more_than_honey,2147907,2013-06-14,Nora Lee Mandel,False,7/10,fresh,Film-Forward.com,"Philosophical rumination on the past, present, and future of those who raise them. . . the busiest workers in agriculture (filmed up close). . .and learn from killer bees.",POSITIVE,http://film-forward.com/star-reviews/more-than-honey
more_than_honey,2147743,2013-06-14,Farran Smith Nehme,True,4/4,fresh,New York Post,"Without any preachiness, this magically beautiful film urges us to take better care of the bees, and honor the irreplaceable things that they do for us.",POSITIVE,http://www.nypost.com/p/entertainment/movies/story_behind_the_sweet_Tx9r7M1opDva7j6mV3tlPO
more_than_honey,2147556,2013-06-13,Mark Jenkins,True,,fresh,NPR,"An amiably shaggy combination of science lesson, whimsical musing and alarm bell ...",POSITIVE,http://www.npr.org/2013/06/13/190348698/more-than-honey-sees-a-world-without-bees?ft=1&f=1045&utm_source=feedly
more_than_honey,2147221,2013-06-12,Mike D'Angelo,True,B,fresh,AV Club,"As a nature doc, More Than Honey rivals such acclaimed forebears as Winged Migration and Microcosmos, though it's working with a more limited scope, visually-if you've seen one honeybee, you've seen 'em all.",POSITIVE,"http://www.avclub.com/articles/more-than-honey,98937/?utm_medium=RSS&utm_campaign=feeds&utm_source=feedly"
more_than_honey,2147191,2013-06-12,David Noh,False,,fresh,Film Journal International,Highly informative and very diverting documentary about the busiest member of the animal kingdom.,POSITIVE,http://www.filmjournal.com/filmjournal/content_display/reviews/specialty-releases/e3ic022233b469e8250a50f80135b73c03e
more_than_honey,2147163,2013-06-12,Drew Hunt,True,3/4,fresh,Slant Magazine,"Markus Imhoof's film reveals itself as a curious, audacious mix of personal essay film and nature documentary.",POSITIVE,http://www.slantmagazine.com/film/review/more-than-honey
more_than_honey,2147079,2013-06-11,Stephen Holden,True,3/5,fresh,New York Times,A fascinating but rambling documentary about the decimation of the world's bee population through the phenomenon known as colony collapse disorder.,POSITIVE,
more_than_honey,2147010,2013-06-11,Sam Adams,True,3/5,fresh,Time Out,"Although the unexplained collapse of honeybee colonies is a global problem, the most startling moments in Markus Imhoof's documentary take place on a microscopic level.",POSITIVE,http://www.timeout.com/us/film/more-than-honey-movie-review
more_than_honey,2145921,2013-06-05,Stephanie Zacharek,True,,fresh,Village Voice,"It's a delightful, informative, and suitably contemplative study of the bee world and the bee-population crisis, though in the end it does offer enough dewdrops of hope to fill up a bluebell or two.",POSITIVE,http://www.villagevoice.com/2013-06-05/film/more-than-honey/
limit_up,2309802,2016-02-20,Dennis Schwartz,False,C+,rotten,Dennis Schwartz Movie Reviews,It makes Goethe's classic masterpiece into something banal.,NEGATIVE,https://dennisschwartzreviews.com/limitup/
limit_up,1451707,2005-11-02,Emanuel Levy,False,2/5,rotten,EmanuelLevy.Com,,NEGATIVE,
limit_up,11283,2000-01-01,Roger Ebert,True,2/4,rotten,Chicago Sun-Times,Limit Up is such a calculating movie that I'm surprised it wasn't a little smarter. How could a screenplay shamelessly recycle so many exploitable ingredients without finding a way to make them entertaining?,NEGATIVE,http://www.rogerebert.com/reviews/limit-up-1989
cover_up_1949,2047233,2011-12-28,Dennis Schwartz,False,B-,fresh,Dennis Schwartz Movie Reviews,Pleasing old-fashioned crime drama.,POSITIVE,https://dennisschwartzreviews.com/coverup/
american_autumn_an_occudoc,2107023,2012-09-28,Kyle Smith,True,0.5/4,rotten,New York Post,This film can't be taken seriously by any serious person.,NEGATIVE,http://www.nypost.com/p/entertainment/movies/american_autumn_an_occu_doc_half_2p7lLVbjrVuMv9U2RcWYZP
american_autumn_an_occudoc,2106769,2012-09-27,Daniel M. Gold,True,3/5,fresh,New York Times,"It will probably not persuade many Occupy critics to change their opinions. But as manifestoes go it is calm and smart, offsetting its stridency with discussion, music, even humor, while issuing a call to arms.",POSITIVE,http://movies.nytimes.com/2012/09/28/movies/dennis-trainor-jrs-american-autumn-an-occudoc.html?partner=rss&emc=rss
american_autumn_an_occudoc,2106745,2012-09-27,Joe Neumaier,True,3/5,fresh,New York Daily News,"Though too much of this of-the-people, for-the-people chronicle is by necessity gummed up by clunky captions and explanations, it is an effective, and heartfelt, clarion call.",POSITIVE,http://www.nydailynews.com/entertainment/tv-movies/movie-reviews-american-autumn-bringing-bobby-article-1.1169648
the_pursuit_of_happiness_1935,2596520,2019-06-12,Helen Brown Norden,False,,fresh,Vanity Fair,"The picture has been intelligently directed; it is quite consistently entertaining; and it has, as I have said, the ingratiating Mr. Lederer in a part well tailored to his talents, including his gift for comedy.",POSITIVE,https://archive.vanityfair.com/article/1934/11/the-screen
spanish_judges,1424567,2005-08-10,Emanuel Levy,False,2/5,rotten,EmanuelLevy.Com,,NEGATIVE,
spanish_judges,231534,2001-06-25,Ryan Cracknell,False,48/100,rotten,Apollo Guide,,NEGATIVE,
spanish_judges,219400,2001-05-10,Christopher Null,False,2/5,rotten,Filmcritic.com,"D'Onofrio, normally a stellar actor, stumbles through the sub-par script, reduced to begging for cashews",NEGATIVE,
a_annan_veg,2497233,2018-08-14,Jamie Neish,False,3.5/5,fresh,HeyUGuys,The performances delivered by Gunnarsson and Guðjónsson do wonders to create some particularly noteworthy moments of humour and heartache and its 1980's setting allows for a level of benevolence most films are lacking.,POSITIVE,https://www.heyuguys.com/eiff-2012-either-way-review/
a_annan_veg,2138623,2013-04-22,Rob Thomas,False,3/4,fresh,"Capital Times (Madison, WI)","""Either Way"" is a slight, ultra-dry comedy with a lot of empty spaces and plenty of silences. But the two main characters are just so endearing that their chemistry fills the gaps nicely.",POSITIVE,http://host.madison.com/entertainment/movies/reviews/wisconsin-film-festival-either-way-heads-in-an-amiable-direction/article_e359dc4c-a84e-11e2-837e-0019bb2963f4.html
la-trinchera-luminosa-del-presidente-gonzalo,2425899,2017-10-10,Jay Kuehner,False,,fresh,Cinema Scope,"Modestly scaled, La Trinchera scores a minor conceptual coup for occupying politically charged territory with the levity of, well, highly evolved karaoke video. Call it a party favour.",POSITIVE,http://cinema-scope.com/currency/currency-shining-trench/
perfect_bid_the_contestant_who_knew_too_much,2688188,2020-05-06,Orla Smith,False,,fresh,Battle Royale With Cheese,A compelling and addictive watch.,POSITIVE,https://battleroyalewithcheese.com/2018/01/review-perfect-bid/
perfect_bid_the_contestant_who_knew_too_much,2688186,2020-05-06,Nate Adams,False,A-,fresh,The Only Critic,"An engrossing, fun, and unbelievable true story. It's also one of the year's best films.",POSITIVE,https://www.theonlycritic.com/single-post/2018/05/19/Adrian-International-Film-Festival-Review-THE-PERFECT-BID
perfect_bid_the_contestant_who_knew_too_much,2514678,2018-10-02,Josh Sorokach,False,,fresh,Decider,"The Price is Right is woven into our cultural iconography, which is why any and all fans of the beloved series will want to check this out.",POSITIVE,https://decider.com/2018/10/02/price-is-right-documentary-perfect-bid-amazon-prime-video/
perfect_bid_the_contestant_who_knew_too_much,2459224,2018-02-21,Bradley Gibson,False,8/10,fresh,Film Threat,"Even if you're not a game show fan, this film is fascinating.",POSITIVE,http://filmthreat.com/reviews/perfect-bid-the-contestant-who-knew-too-much/
perfect_bid_the_contestant_who_knew_too_much,2446619,2017-12-29,Chloe Walker,False,,fresh,Film Inquiry,"Perfect Bid is a perfectly fine film. At seventy minutes long, it doesn't overstay its welcome, it's warmly presented, and offers up some interesting behind-the-scenes insights into one of the world's most famous game shows.",POSITIVE,https://www.filminquiry.com/perfect-bid-2017-review/
perfect_bid_the_contestant_who_knew_too_much,2441961,2017-12-10,Simon Foster,False,4/5,fresh,Screen-Space,[One] of the most remarkable moments of television history is examined with an acutely insightful eye and jaunty rhythm in director C.J. Wallis' hugely enjoyable doc.,POSITIVE,http://screen-space.squarespace.com/reviews/2017/12/10/perfect-bid-the-contestant-who-knew-too-much.html
its-a-wonderful-world-1939,2717407,2020-08-28,SMH Staff,True,,fresh,Sydney Morning Herald,"Miss Colbert is an attractive, saucy minx, albeit possessed of too much uncontrolled ardour. James Stewart bungs a mixture of whimsicality and gruffness to his role.",POSITIVE,https://trove.nla.gov.au/newspaper/article/17609400/1132097
its-a-wonderful-world-1939,2252160,2015-03-19,Dennis Schwartz,False,A-,fresh,Dennis Schwartz Movie Reviews,Wonderful screwball comedy.,POSITIVE,http://www.sover.net/~ozus/itsawonderfulworld.html
sniper_ultimate_kill,2509480,2018-09-12,Barbara Shulgasser,False,1/5,rotten,Common Sense Media,"U.S. agents capture drug lord; graphic violence, sex.",NEGATIVE,https://www.commonsensemedia.org/movie-reviews/sniper-ultimate-kill
a_state_of_mind_2005,1643176,2007-06-28,Louis Proyect,False,,fresh,rec.arts.movies.reviews,"A North Korean version of films like ""Hoop Dreams"". Humanizes a people who are considered outside of humanity in the West.",POSITIVE,http://louisproyect.wordpress.com/2007/06/27/inside-north-korea-two-documentaries/
a_state_of_mind_2005,1603515,2007-03-01,Maria Garcia,False,,rotten,Film Journal International,"Will raise many more questions about totalitarianism, and about the foreign policies of Western countries with regard to North Korea, than it ever answers.",NEGATIVE,http://www.filmjournal.com/filmjournal/reviews/article_display.jsp?vnu_content_id=1001014291
a_state_of_mind_2005,1602075,2007-02-26,Jules Brenner,False,3/5,rotten,Cinema Signals,a slanted view is better than none at all,NEGATIVE,http://variagate.com/statmind.htm?MRQE
a_state_of_mind_2005,1507320,2006-05-18,Brian Gibson,False,,fresh,"Vue Weekly (Edmonton, Alberta)","Thrusts you into the near-hypnotic mentality of a 1984-ish place. But once you return to [your] society . . . [look again at] those darkly concealing words, ""freedom"" and ""democracy.""",POSITIVE,
a_state_of_mind_2005,1471584,2006-01-14,Ed Gonzalez,True,3/4,fresh,Slant Magazine,State of Mind is an eye-opener.,POSITIVE,http://www.slantmagazine.com/film/film_review.asp?ID=1743
a_state_of_mind_2005,1441437,2005-09-30,Richard James Havis,True,,fresh,Hollywood Reporter,This fascinating documentary details day-to-day life in the hard-line Communist state of North Korea.,POSITIVE,
a_state_of_mind_2005,1437786,2005-09-23,Jeff Shannon,True,3.5/4,fresh,Seattle Times,A riveting BBC documentary that illuminates the character of that nation.,POSITIVE,http://seattletimes.nwsource.com/html/movies/2002513906_shortkorea23.html
a_state_of_mind_2005,1437396,2005-09-22,William Arnold,False,B,fresh,Seattle Post-Intelligencer,The film gives a rare glimpse into everyday life in the Far East-wing of the Axis of Evil.,POSITIVE,http://seattlepi.nwsource.com/movies/241837_limited23.html
a_state_of_mind_2005,1435748,2005-09-16,Robert W. Butler,False,3/4,fresh,Kansas City Star,"It's so secretive, so insulated, that it's hard to imagine what life there is really like. That's what makes A State of Mind ... essential viewing.",POSITIVE,http://www.kansascity.com/mld/kansascity/entertainment/12654270.htm
a_state_of_mind_2005,1433383,2005-09-08,Chris Hewitt,False,2.5/4,fresh,St. Paul Pioneer Press,"The documentary about life in North Korea sets the story of two girls against the backdrop of a huge tribute to leader Kim Jong Il, and it's the backdrop that is more compelling.",POSITIVE,
a_state_of_mind_2005,1432454,2005-09-03,Stephen Schaefer,False,2/4,rotten,Boston Herald,,NEGATIVE,http://theedge.bostonherald.com/movieReviews/view.bg?articleid=100669
