id,reviewId,creationDate,criticName,isTopCritic,originalScore,reviewState,publicatioName,reviewText,scoreSentiment,reviewUrl
10terrorists,2098053,2012-08-03,Don Groves,False,3/5,fresh,sbs.com.au,Low-budget black comedy skewers reality TV and the quest for fame.,POSITIVE,http://www.sbs.com.au/films/movie/14168/10-terrorists
stay_cool,2012046,2011-09-16,Jason Bailey,True,1/5,rotten,DVDTalk.com,,NEGATIVE,http://www.dvdtalk.com/reviews/52346/stay-cool/
stay_cool,2011905,2011-09-15,Robert Abele,True,1.5/5,rotten,Los Angeles Times,"Attempts to pay homage to the '80s oeuvre of filmmaker John Hughes, but its singular lack of emotional logic, charm and humor bring to mind a couple of hours in detention instead.",NEGATIVE,"http://www.latimes.com/entertainment/news/reviews/la-et-capsules-stay-cool-20110916,0,3349263.story?track=rss"
stay_cool,2011704,2011-09-15,Brian Orndorf,False,C+,rotten,BrianOrndorf.com,"Stay Cool is their most grounded effort, attacking the formulaic discomfort and confusion of an impending high school reunion. It doesn't always convince, but it's the most approachable Polish production to date.",NEGATIVE,http://www.brianorndorf.com/2011/09/film-review-stay-cool.html
stay_cool,1828659,2009-06-22,Amber Wilkinson,False,3/5,fresh,Eye for Film,There is much here to find admirable but a whole lot less to genuinely like.,POSITIVE,http://www.eyeforfilm.co.uk/reviews.php?id=8031
stay_cool,1818940,2009-05-06,Marlow Stern,False,2/5,rotten,Manhattan Movie Magazine,like an exercise in calculated nostalgia,NEGATIVE,
stay_cool,1818509,2009-05-03,Adam Keleman,True,,rotten,Slant Magazine,"This is thoroughly a family affair, but with the Polish brothers' upcoming film Manure just around the corner, Stay Cool feels a bit rushed, suggesting nothing more than an homage to Pretty in Pink or Some Kind of Wonderful.",NEGATIVE,http://www.slantmagazine.com/film/review/stay-cool
truth_about_love,1970762,2011-04-04,Matthew Turner,False,1/5,rotten,ViewLondon,,NEGATIVE,http://www.viewlondon.co.uk/films/the-truth-about-love-film-review-18396.html
truth_about_love,1600317,2007-02-19,Cosmo Landesman,False,1/5,rotten,Sunday Times (UK),"The film is silly when it should be sexy, witless when trying to be funny. Everyone involved is probably deeply embarrassed to be associated with it.",NEGATIVE,http://entertainment.timesonline.co.uk/tol/arts_and_entertainment/film/article1389990.ece
truth_about_love,1599344,2007-02-16,David Gritten,True,,rotten,Daily Telegraph (UK),"An awkward, last-minute romantic dash to Bristol's Temple Meads station in the style of Richard Curtis only serves to underline the air of creative bankruptcy.",NEGATIVE,http://www.telegraph.co.uk/arts/main.jhtml?view=DETAILS&grid=&xml=/arts/2007/02/16/nosplit/bffuzz116.xml
truth_about_love,1599336,2007-02-16,Anthony Quinn,True,2/5,rotten,Independent (UK),"John Hay's film has been on the shelf since 2004, and whoever decided to take it from there has some explaining to do.",NEGATIVE,http://arts.independent.co.uk/film/reviews/article2272693.ece
truth_about_love,1599327,2007-02-16,Peter Bradshaw,True,1/5,rotten,Guardian,The Worst Film of 2007 awards race has now been called off.,NEGATIVE,"http://film.guardian.co.uk/News_Story/Critic_Review/Guardian_review/0,,2013760,00.html"
truth_about_love,1599301,2007-02-16,Anton Bitel,False,1.5/5,rotten,Film4,"The truth is, no matter how pretty this picture may be to look at, nothing can conceal its singular lack of humour or heart.",NEGATIVE,http://www.channel4.com/film/reviews/film.jsp?id=160276
truth_about_love,1599292,2007-02-16,Paul Arendt,True,1/5,rotten,BBC.com,It is a poor movie indeed that makes you reconsider the talent of Richard Curtis.,NEGATIVE,http://www.bbc.co.uk/films/2007/02/12/the_truth_about_love_2007_review.shtml
truth_about_love,1598812,2007-02-14,Anna Smith,True,,rotten,Time Out,"while Dougray Scott is a viable romantic alternative, he's absent from too much of the film, leaving Alice to discover 'The Truth About Love' long after we all stopped caring.",NEGATIVE,http://www.timeout.com/film/84129.html
truth_about_love,1598800,2007-02-14,James White,False,1/5,rotten,Total Film,"Borrowed liberally from stock British elements (Dougray Scott's character is restoring a boat! There's a chase to stop a lover leaving!), there's nothing new to enjoy here.",NEGATIVE,http://www.totalfilm.com/cinema_reviews/films_out_this_week/the_truth_about_love
truth_about_love,1598725,2007-02-14,Anna Smith,True,1/5,rotten,Empire Magazine,A decent idea and cast are neglected in this ungainly Britcom with less of the com. A British actress might have been a better bet for this one.,NEGATIVE,http://www.empireonline.com/reviews/ReviewComplete.asp?FID=134749
truth_about_love,1524386,2006-07-11,David Nusair,False,1.5/4,rotten,Reel Film Reviews,"...a predictable, thoroughly cliched romantic comedy...",NEGATIVE,http://www.reelfilm.com/mini58.htm#truth
this_is_what_love_in_action_looks_like_2011,2729242,2020-09-26,Richard Propes,False,3.0/4.0,fresh,TheIndependentCritic.com,A poignant and anger-inducing feature documentary from Morgan Jon Fox.,POSITIVE,https://theindependentcritic.com/this_is_what_love_in_action_looks_like
this_is_what_love_in_action_looks_like_2011,2083452,2012-05-12,Fr. Chris Carpenter,False,B,fresh,Movie Dearest,"Moves along briskly and subsequently doesn't allow for much nuance, but its potency can't be denied.",POSITIVE,http://moviedearest.blogspot.com/2012/05/reverends-reviews-love-denial.html
this_is_what_love_in_action_looks_like_2011,2027354,2011-11-17,John Beifuss,False,3/4,fresh,"Commercial Appeal (Memphis, TN)",Morgan Jon Fox's six-years-in-the-making documentary was inspired by 'a modern-day message in a bottle': a teen MySpace user's plea to be freed from a controversial 'conversion therapy' program designed to transform homosexuals into 'ex-gay' Christians.,POSITIVE,http://blogs.commercialappeal.com/the_bloodshot_eye/2011/11/indie-memphis-film-festival-2011-day-two-preview---friday-nov-4.html
sometimes_a_great_notion,2698045,2020-06-22,Quentin Tarantino,False,,fresh,The New Beverly,"Sometimes a Great Notion is a good somewhat compromised movie, that is justly famous for one of the greatest scenes in early seventies cinema.",POSITIVE,https://web.archive.org/web/20200323120042/https://thenewbev.com/tarantinos-reviews/sometimes-a-great-notion/
sometimes_a_great_notion,2688566,2020-05-07,Alberto Abuín,False,,fresh,Espinof,"Newman's security, both behind and in front of the camera, is overwhelming. [Full Review in Spanish]",POSITIVE,https://www.espinof.com/criticas/paul-newman-casta-invencible-la-epica-de-una-forma-de-vida-odiada
sometimes_a_great_notion,2021162,2011-11-01,J. Hoberman,True,,fresh,Village Voice,A New Hollywood movie suffused in Old Hollywood values.,POSITIVE,http://www.villagevoice.com/2011-11-02/film/deserved-second-act-for-paul-newman-s-sometimes-a-great-notion/
sometimes_a_great_notion,2021142,2011-11-01,Stephen Garrett,True,4/5,fresh,Time Out,"It's not a classic, in the sense of being perfectly formed. But the craft work is one of a kind.",POSITIVE,http://newyork.timeout.com/arts-culture/film/2165791/review-sometimes-a-great-notion
sometimes_a_great_notion,1834679,2009-07-29,Emanuel Levy,False,B-,fresh,EmanuelLevy.Com,"Based on Ken Kesey's book, Newman's second film as helmer is not effective or cohesive as the first (Rachel Rachel), but Oregon locations and good acting by Henry Fonda and others compensate for uneasy fit between melodrama and action",POSITIVE,http://emanuellevy.com/search/details.cfm?id=13925
sometimes_a_great_notion,1791785,2009-01-18,Dennis Schwartz,False,B-,fresh,Dennis Schwartz Movie Reviews,"When the film cuts away from the family soap opera dramatics and shows the macho men at work wielding their chainsaws at the logging camp among the giant trees, it has a buzz.",POSITIVE,https://dennisschwartzreviews.com/sometimesagreatnotion/
sometimes_a_great_notion,1735411,2008-06-17,Variety Staff,True,,fresh,Variety,The result is rather good -- a sort of contemporary 'western' in the timber territory.,POSITIVE,http://www.variety.com/review/VE1117795029
sometimes_a_great_notion,1616187,2007-04-20,Lori Hoffman,False,4/5,fresh,Atlantic City Weekly,Terrific family drama,POSITIVE,
sometimes_a_great_notion,1476106,2006-01-26,Time Out Staff,True,,fresh,Time Out,"Newman's handling of the outdoor scenes, especially those involving work, is -- like his own acting -- restrained but powerfully evocative.",POSITIVE,https://www.timeout.com/london/film/sometimes-a-great-notion
sometimes_a_great_notion,1419496,2005-07-27,Jules Brenner,False,4/5,fresh,Cinema Signals,,POSITIVE,
sometimes_a_great_notion,1389190,2005-05-09,Vincent Canby,True,3/5,fresh,New York Times,Surprisingly effective.,POSITIVE,http://movies.nytimes.com/movie/review?res=9D0CE2DA143DEF34BC4A53DFB5668389669EDE&partner=Rotten Tomatoes
sometimes_a_great_notion,1331615,2004-10-23,Roger Ebert,True,3/4,fresh,Chicago Sun-Times,"Newman starts tunneling under the material, coming up with all sorts of things we didn't quite expect, and along the way he proves himself as a director of sympathy and a sort of lyrical restraint.",POSITIVE,https://www.rogerebert.com/reviews/sometimes-a-great-notion-1971
sometimes_a_great_notion,1148507,2003-05-24,Film4 Staff,False,,fresh,Film4,Newman handles the emotional drama well and directs one outdoor scene with consummate brilliance.,POSITIVE,http://www.channel4.com/film/reviews/film.jsp?id=108512
berkeley_in_the_sixties,2009171,2011-09-07,Owen Gleiberman,True,A-,fresh,Entertainment Weekly,,POSITIVE,"http://www.ew.com/ew/article/0,,318754,00.html"
berkeley_in_the_sixties,1982753,2011-04-30,Emanuel Levy,False,B,fresh,EmanuelLevy.Com,A significant docu in which the director lets his rich material speak for itself,POSITIVE,http://www.emanuellevy.com/review/berkeley-in-the-sixties-5/
berkeley_in_the_sixties,1440373,2005-09-29,Ken Hanke,False,4/5,fresh,"Mountain Xpress (Asheville, NC)",It's as relevant today as ever.,POSITIVE,http://www.mountainx.com/movies/b/berkeleyinthesixties.php
berkeley_in_the_sixties,1414462,2005-07-16,Emanuel Levy,False,3/5,fresh,EmanuelLevy.Com,,POSITIVE,
berkeley_in_the_sixties,835337,2003-01-21,Kurt Dahlke,False,85/100,fresh,Apollo Guide,,POSITIVE,http://www.apolloguide.com/mov_fullrev.asp?CID=4691
berkeley_in_the_sixties,282067,2002-01-27,John A. Nesbit,False,A-,fresh,Old School Reviews,...as complete a picture as possible in less than two hours. And you don't even have to smell the tear gas.,POSITIVE,http://oldschoolreviews.com/rev_90/berkeley.htm
daniel_defoes_robinson_crusoe,1419396,2005-07-27,Emanuel Levy,False,2/5,rotten,EmanuelLevy.Com,,NEGATIVE,
daniel_defoes_robinson_crusoe,1337756,2004-11-13,Dan Lybarger,False,5/5,fresh,eFilmCritic.com,,POSITIVE,http://efilmcritic.com/review.php?movie=11100&reviewer=382
daniel_defoes_robinson_crusoe,283980,2002-02-03,Christopher Null,False,2/5,rotten,Filmcritic.com,Laughable,NEGATIVE,
une_belle_fille_comme_moi,2677942,2020-03-18,Richard Combs,True,,rotten,Sight & Sound,"In the comic context of A Gorgeous Bird Like Me, a good deal of the savour is lost simply because this femme comes over as much less fatale than may have been intended.",NEGATIVE,https://archive.org/details/Sight_and_Sound_1973_10_BFI_GB/page/n59/mode/2up
une_belle_fille_comme_moi,2197745,2014-04-14,Richard Brody,True,,fresh,New Yorker,"Lafont's antic embodiment of feminine ferocity cuts cleverly against Truffaut's grim vision of a world that both represses and craves it, and the comedy masks the endless round of victimhood.",POSITIVE,http://www.newyorker.com/arts/reviews/film/such_a_gorgeous_kid_like_me_truffaut
1111945-1111945-smokers,1426220,2005-08-13,Emanuel Levy,False,2/5,rotten,EmanuelLevy.Com,,NEGATIVE,
1111945-1111945-smokers,1256360,2004-03-04,Oz,False,1/5,rotten,eFilmCritic.com,"Decrepit filmmaking, the likes of which should see at least the director, if not the producers, never hold a similar position again.",NEGATIVE,http://efilmcritic.com/review.php?movie=8564&reviewer=1
1111945-1111945-smokers,283982,2002-02-03,Bill Chambers,False,1.5/4,fresh,Film Freak Central,"Aimless, feckless, and finally bad, an indie made with an absence not only of cash but also vision...",POSITIVE,http://filmfreakcentral.net/dvdreviews/smokers.htm
1111945-1111945-smokers,277211,2002-01-06,Christopher Null,False,2/5,rotten,Filmcritic.com,Of little substance.,NEGATIVE,
hidden_blade_2023,102783667,2023-02-28,Aja Romano,True,,fresh,Vox,"As much as Tony Leung was made for subtle but heady roles like this, Hidden Blade belongs to Wang Yibo, and so does this review.",POSITIVE,https://www.vox.com/culture/23617140/hidden-blade-wuming-review-wang-yibo-tony-leung-cheng-er
hidden_blade_2023,102783209,2023-02-25,Kate Sánchez,False,7/10,fresh,But Why Tho? A Geek Community,Hidden Blade&#160;is a film that attempts to shock its audience&#44; drilling home how terrifying and heartbreaking war is&#46; That said&#46;&#46;&#46;Hidden Blade&#160;twists the story too many times that it begins to buckle under itself&#46;,POSITIVE,https://butwhytho.net/2023/02/hidden-blade-review/
hidden_blade_2023,102781365,2023-02-20,Jacob Oller,False,7.7/10,fresh,Paste Magazine,The handsome noir skillfully makes its ideological crash &#40;and inevitably propagandistic bent&#41; part of the confounding atmosphere&#44; shrouding it in smoke&#44; food&#44; mirrors and sake&#46;,POSITIVE,https://www.pastemagazine.com/movies/hidden-blade-review/
hidden_blade_2023,102781119,2023-02-18,Simon Abrams,True,2/4,rotten,RogerEbert.com,Gorgeous and empty&#46;,NEGATIVE,https://www.rogerebert.com/reviews/hidden-blade-movie-review-2023
hidden_blade_2023,102780958,2023-02-17,Cary Darling,True,3.5/5,fresh,Houston Chronicle,&quot;Hidden Blade&#44;&quot; a stylish&#44; nonlinear exercise in Chinese film noir&#44; is one of those movies where&#44; at first&#44; you&apos;re not exactly sure where it&apos;s going or what anyone&apos;s doing&#46; But&#44; boy&#44; do they look great doing it&#46;,POSITIVE,https://preview.houstonchronicle.com/movies-tv/hidden-blade-review-17785040
hidden_blade_2023,102780904,2023-02-17,Christopher Cross,False,2.5/5,rotten,Tilt Magazine,An otherwise atmospheric and moody period piece&#44; Hidden Blade always seems to undercut its strengths and delivers a middling spy film that never quite scratches below the surface&#46;,NEGATIVE,https://tilt.goombastomp.com/film/hidden-blade-review/
hidden_blade_2023,102780647,2023-02-17,Allen Almachar,False,B,fresh,The MacGuffin,On a purely aesthetic basis&#44; this is a slick and handsomely made production&#46;,POSITIVE,https://macguff.in/film-reviews/hidden-blade/
hidden_blade_2023,102780338,2023-02-16,Mark Dujsik,False,1.5/4,rotten,Mark Reviews Movies,To attempt to follow the plot of Hidden Blade is difficult and&#44; essentially&#44; a fool&apos;s errand&#46;,NEGATIVE,http://www.markreviewsmovies.com/reviews/H/hiddenblade-2023.htm
hidden_blade_2023,102780314,2023-02-16,Roger Moore,False,2.5/4,fresh,Movie Nation,I found the whole &quot;Hidden Blade&quot; rather less satisfying than its component parts&#46; The many characters&#44; myriad plot points and points of view and added complications with the timeline just clutter things up&#46;,POSITIVE,https://rogersmovienation.com/2023/02/16/movie-review-chinas-wwii-intrigues-and-treachery-fighting-japan-with-a-hidden-blade/
hidden_blade_2023,102780297,2023-02-16,Austin Considine,True,,rotten,New York Times,"However crisp and stylishly executed, the parts don’t quite add up to a satisfying whole.",NEGATIVE,https://www.nytimes.com/2023/02/16/movies/hidden-blade-review.html
hidden_blade_2023,102780285,2023-02-16,G. Allen Johnson,True,2.5/4,fresh,San Francisco Chronicle,"While it is eminently watchable, it’s a movie that consists of mostly people sitting at tables with fantastic period clothing plotting and scheming, but sometimes barely moving at all.",POSITIVE,https://datebook.sfchronicle.com/movies-tv/hidden-blade-review-china-tony-leung-17784890
hidden_blade_2023,102780261,2023-02-16,Avi Offer,False,,fresh,NYC Movie Guru, Visually stylish&#44; well-edited and intelligent spy thriller&#44; but also somewhat dry&#44; tedious and exhausting&#46;,POSITIVE,http://nycmovieguru.com/feb17th23.html#hiddenblade
hidden_blade_2023,102780093,2023-02-15,Keith Garlington,False,4/5,fresh,Keith & the Movies,It&#8217;s absorbing cinema&#46; And even with its not-so-hidden nationalistic bend&#44; its a beguiling spy thriller with a stylishly sumptuous genre veneer&#46;,POSITIVE,https://keithandthemovies.com/2023/02/15/review-hidden-blade-2023/
hidden_blade_2023,102780077,2023-02-15,Nathaniel Muir,False,,fresh,AIPT,Hidden Blade walks the line between art film and commercial extravaganza&#46; The end result is a spectacle movie with a focus on story&#46; Though director Er Cheng gets the tone right&#44; there are some awkward moments&#46; &#10;&#10;,POSITIVE,https://aiptcomics.com/2023/02/15/hidden-blade-review-beautifully-shot-world-war-ii-espionage-thriller/
hidden_blade_2023,102779033,2023-02-11,Panos Kotzathanasis,False,7.5,fresh,Asian Movie Pulse,Cheng Er seems to have studied Tarantino&#44; Hong Kong and Korean cinema quite thoroughly and the result is a truly exceptional spy thriller that thrives equally on visuals&#44; acting and overall atmosphere&#46; &#10;&#10;,POSITIVE,https://asianmoviepulse.com/2023/02/film-review-hidden-blade-2023-by-cheng-er/
pimp_2010,1885526,2010-05-21,Allan Hunter,False,1/5,rotten,Daily Express (UK),"Tight close-ups and direct-to- camera confessionals are the order of the day in a film so peppered with sleazy sex, casual violence and endless swearing that it comes perilously close to caricature. Nobody's finest hour.",NEGATIVE,http://www.express.co.uk/entertainment/view/176396/Pimp-Film-review-and-trailer
pimp_2010,1885523,2010-05-21,Anthony Quinn,True,1/5,rotten,Independent (UK),"The plot, concerning the identity of a snuff-movie killer, is a gruesome mixture of sexual sadism and sentimentality, made even less palatable by dialogue of quarter-witted aggression.",NEGATIVE,http://www.independent.co.uk/arts-entertainment/films/reviews/pimp-18-1978582.html
pimp_2010,1885521,2010-05-21,Antonia Quirke,True,2/5,rotten,Financial Times,"Awful -- bad acting, the worst kind of cockney clichés.",NEGATIVE,http://www.ft.com/cms/s/2/c28e02cc-6355-11df-a844-00144feab49a.html
pimp_2010,1885519,2010-05-21,Trevor Johnston,False,1/5,rotten,Radio Times,"The sight of Dyer operating under the delusion he's channelling Al Pacino is grim enough, but the real blame must be laid at the door of director/star/co-writer Cavanah, who seriously underperforms in all three roles.",NEGATIVE,http://www.radiotimes.com/servlet_film/com.icl.beeb.rtfilms.client.simpleSearchServlet?searchTypeSelect=5&frn=49910
pimp_2010,1885517,2010-05-21,Ellen E Jones,False,1/5,rotten,Total Film,You wouldn't think a film could actually be both very boring and very offensive. Pimp is that paradox made flesh,NEGATIVE,http://www.totalfilm.com/reviews/cinema/pimp-1
pimp_2010,1885514,2010-05-21,Tim Evans,False,,rotten,Sky Cinema,For a film that limply purports to lift the lid on the sordid world of Soho sex trafficking this dismal offering is chock full of rank misogyny.,NEGATIVE,http://movies.sky.com/review/pimp
pimp_2010,1885513,2010-05-21,Paul Fairclough,True,,rotten,Little White Lies,Both breathtakingly crass and unintentionally funny without ever being engaging or entertaining.,NEGATIVE,
pimp_2010,1885512,2010-05-21,Cath Clarke,True,1/5,rotten,Guardian,"With nil insight - into the sex industry or anything else - you might conclude Pimp is a film for men who get their kicks watching Dyer strut around leering at topless women who -- in the parlance of the film -- look like ""the basic pleasure model"".",NEGATIVE,http://www.guardian.co.uk/film/2010/may/20/pimp-film-review
pimp_2010,1885509,2010-05-21,David Hayles,True,1/5,rotten,Times (UK),"It does, however, make you pity the desperate men and women who allow themselves to be degraded on camera for a few quid (the actors in Pimp).",NEGATIVE,http://entertainment.timesonline.co.uk/tol/arts_and_entertainment/film/film_reviews/article7131204.ece
pimp_2010,1885507,2010-05-21,David Jenkins,True,1/5,rotten,Time Out,"With its excessive levels of casual racism, sexism and homophobia, the film feels like nothing more than a rejected 'Derek and Clive' sketch that's been stripped of eloquence and irony and calibrated instead for cheap, leery laughs.",NEGATIVE,http://www.timeout.com/film/reviews/88558/pimp.html
pimp_2010,1899906,1800-01-01,Matthew Turner,False,2/5,rotten,ViewLondon,,NEGATIVE,http://www.viewlondon.co.uk/films/pimp-film-review-34049.html
singh_is_bliing,2615826,2019-08-15,Udita Jhunjhunwala,True,,rotten,Livemint,"With its lame script and tiresome gags, you'll forget Singh Is Bliing within seconds of leaving the cinema.",NEGATIVE,https://www.livemint.com/Leisure/VMDJ77u93enP38TvfVg21I/Film-review-Singh-Is-Bliing.html
singh_is_bliing,2487264,2018-06-27,Sukanya Verma,False,2/5,rotten,Rediff.com,"When they announced Singh is Bliing, I was most curious about its peculiar title and kitschy poster. I don't know why they called it that. What I do know is all that glitters is not gold.",NEGATIVE,http://www.rediff.com/movies/review/review-akshay-kumar-dazzles-singh-is-bliing-does-not/20151002.htm
singh_is_bliing,2487263,2018-06-27,Mike McCahill,True,1/5,rotten,Guardian,"Kumar gave a laudably serious, committed performance in August's prominent flop Brothers, but his follow-up looks very much like a reversion to give-'em-what-they-want type.",NEGATIVE,https://www.theguardian.com/film/2015/oct/04/singh-is-bliing-review-akshay-kumar-comedy-fails-to-shiine
singh_is_bliing,2487262,2018-06-27,Lisa Tsering,True,,rotten,Hollywood Reporter,"The alarming number of scenes objectifying, or downright insulting, female characters mark Prabhudheva as a prolific misogynist.",NEGATIVE,https://www.hollywoodreporter.com/review/singh-is-bliing-film-review-829584
singh_is_bliing,2487261,2018-06-27,Rohit Vats,False,1/5,rotten,Hindustan Times,Akshay Kumar's Singh Is Bliing could well be the last word on puerile humour Bollywood tries so hard to excel in often.,NEGATIVE,https://www.hindustantimes.com/movie-reviews/singh-is-bliing-review-nothing-is-shining-here/story-IZzAVR7Gq3mVXbCCWYfrXI.html
singh_is_bliing,2487259,2018-06-27,Renuka Vyavahare,False,3/5,fresh,The Times of India,"This Singh is silly but cute and endearing. Do not miss his starry entry on the beats of a foot-tapping bhangra number, Tung Tung Baje.",POSITIVE,https://timesofindia.indiatimes.com/entertainment/hindi/movie-reviews/Singh-Is-Bliing/movie-review/49192445.cms
singh_is_bliing,2431610,2017-10-30,Devesh Sharma,False,,fresh,Filmfare,"Lara [Dutta] is a hoot as she deadpans her lines, showing flair for campy comedy.",POSITIVE,https://www.filmfare.com/reviews/movie-review-singh-is-bliing-10711.html
singh_is_bliing,2402030,2017-06-27,Shilpa Jamkhandikar,False,,fresh,Reuters,Where Singh is Bliing differs from the tried and tested is that the leading lady is not reduced to a simpering mess waiting for her knight in shining armour to rescue her. Prabhudheva's heroine is the one doing the rescuing for much of the film.,POSITIVE,http://blogs.reuters.com/india/2015/10/02/movie-review-singh-is-bliing/
singh_is_bliing,2398315,2017-06-07,Nandini Ramnath,False,,fresh,Scroll.in,"At 141 minutes, Singh is Bliing is as overstretched as most Bollywood extravaganzas, but it coasts along on its often wacky humour, its minor characters (Lara Dutta is a hoot) and the chemistry between Jackon and Kumar.",POSITIVE,http://scroll.in/article/759358/film-review-amy-jackson-outshines-the-rest-of-the-turbanator-tribe-in-singh-is-bliing
singh_is_bliing,2289805,2015-10-19,Namrata Joshi,True,1.5/4,rotten,Outlook,Laughless and boring.,NEGATIVE,http://www.outlookindia.com/article/singh-is-bliing/295518
super_duper_alice_cooper,2798267,2021-06-15,Rhian Daly,False,4/5,fresh,NME,"The film's real masterstroke, however, is to cut in clips from the 1920 film Dr. Jekyll And Mr Hyde. This fits not only Cooper's love of vintage horror, but also the film's over-arching narrative...",POSITIVE,https://www.nme.com/reviews/reviews-alice-cooper-15341-309415
super_duper_alice_cooper,2762444,2021-02-01,Richard Crouse,False,3/5,fresh,Richard Crouse,"A fan friendly pastiche of images, sounds and info on one of the most outrageous rock 'n' roll acts ever.",POSITIVE,http://www.richardcrouse.ca/super-duper-alice-cooper-3-stars/
super_duper_alice_cooper,2506258,2018-08-31,Pat Padua,False,2.75,rotten,Spectrum Culture,The familiar arc is fueled by a potent theme that drove the persona that made him a millionaire: Good vs. Evil. If only the movie were as potent as that theme.,NEGATIVE,https://spectrumculture.com/2014/04/29/super-duper-alice-cooper/
super_duper_alice_cooper,2227381,2014-10-10,Jeff Baker,False,B,fresh,Oregonian,"The story is a familiar one, the vintage clips are great, and if you like Alice Cooper, you'll love it.",POSITIVE,http://www.oregonlive.com/movies/index.ssf/2014/10/reel_music_2014_super_duper_al.html
super_duper_alice_cooper,2201696,2014-05-08,Dennis Harvey,True,,fresh,Variety,"This enjoyable ride should appeal to Alice Cooper's original fans, as well as those who came to him via the performers he influenced.",POSITIVE,http://variety.com/2014/film/reviews/film-review-super-duper-alice-cooper-1201171460/
super_duper_alice_cooper,2199913,2014-04-25,Kevin Jagernauth,False,C,rotten,The Playlist,"Something like a cinematic Wikipedia entry, Super Duper Alice Cooper re-establishes the already familiar story of the rocker, but never stops long enough at any moment to get any real meaning out of it.",NEGATIVE,http://blogs.indiewire.com/theplaylist/tribeca-review-super-duper-alice-cooper-a-pedestrian-look-at-the-outrageous-rock-n-roll-icon-20140423
